{
  "artifactType": "security-handoff",
  "schemaVersion": "1.0.0",
  "reviewId": "review-20260506T191313Z",
  "status": "cleared",
  "createdAt": "2026-05-06T19:13:14+00:00",
  "updatedAt": "2026-05-06T19:13:14+00:00",
  "targetAgent": "security-engineer",
  "requestedBy": "reviewer",
  "reason": "Auth modificada.",
  "affectedFiles": [
    "src/features/auth/AuthProvider.tsx"
  ],
  "evidenceIds": [
    "F-001"
  ],
  "gateSummary": [
    "lint=passed (blocking)"
  ]
}
