{
  "artifactType": "security-handoff",
  "schemaVersion": "1.0.0",
  "reviewId": "review-20260423T002233Z",
  "status": "cleared",
  "createdAt": "2026-04-23T00:22:34+00:00",
  "updatedAt": "2026-04-23T00:22:34+00:00",
  "targetAgent": "security-engineer",
  "requestedBy": "reviewer",
  "reason": "Mudanca em auth precisa de revisao dedicada.",
  "affectedFiles": [
    "backend/api/deps/auth.py",
    "src/features/auth/AuthProvider.tsx"
  ],
  "evidenceIds": [],
  "gateSummary": [
    "lint=passed (blocking)"
  ]
}
